{"schema_version":"1.0","acquisition_id":"official-mnq-202609-5m-inventory-20260622-20260724-v2","cohort_id":"mnq-202609-5m-v1","contract":{"contract_label":"MNQ SEP26","master_name":"MNQ","full_name":"MNQ SEP26","expiry_month":9,"expiry_year":2026},"bar_series":{"type":"Minute","value":5,"native":true,"timestamp_semantics":"NinjaTrader native Minute bar close timestamp in application time"},"trading_hours":{"name":"CME US Index Futures ETH","timezone_id":"Central Standard Time","exchange_trading_date_member":"ActualTradingDayExchange"},"civil_date_start":"2026-06-22","civil_date_end":"2026-07-24","canonicalization_id":"NINJATRADER_SEMICOLON_OHLCV_UTF8_LF_FINAL_NEWLINE_V1","observations":[{"civil_date":"2026-06-22","classification":"SESSION","exchange_trading_date":"2026-06-22","schedule_evidence":{"holiday_name":null,"partial_session":false,"expected_open_segments":[{"begin_application":"2026-06-21T17:00:00.0000000-05:00","end_application":"2026-06-22T16:00:00.0000000-05:00","begin_pc":"2026-06-22T06:00:00.0000000+08:00","end_pc":"2026-06-23T05:00:00.0000000+08:00"}],"scheduled_breaks":[],"application_session_begin":"2026-06-21T17:00:00.0000000-05:00","application_session_end":"2026-06-22T16:00:00.0000000-05:00","pc_log_session_begin":"2026-06-22T06:00:00.0000000+08:00","pc_log_session_end":"2026-06-23T05:00:00.0000000+08:00","effective_schedule_source":"SessionIterator using Bars.TradingHours and ActualTradingDayExchange"},"quality":{"observed_native_five_minute_bar_count":276,"observed_valid_count_from_session_start":276,"first_observed_timestamp":"20260622 060500","two_hundred_fiftieth_native_timestamp":"20260623 025000","last_observed_session_timestamp":"20260623 050000","supplied_order_strictly_increasing":true,"duplicate_timestamp_indexes":[],"duplicate_timestamp_count":0,"decreasing_timestamp_indexes":[],"decreasing_timestamp_count":0,"missing_expected_open_timestamps":[],"missing_expected_open_timestamp_count":0,"unexpected_timestamps":[],"unexpected_timestamp_count":0,"malformed_or_non_finite_ohlcv_indexes":[],"malformed_or_non_finite_ohlcv_count":0,"invalid_ohlc_geometry_indexes":[],"invalid_ohlc_geometry_count":0,"negative_volume_indexes":[],"negative_volume_count":0,"non_integral_volume_indexes":[],"non_integral_volume_count":0,"first_250_source_sha256":"0d35adcdc674acccbd80e0e584d0ea829664eb1aaf9344542138243e6ca8b560","complete_session_source_sha256":"ed1f8c32161ce5702582532808715d4e0a5413e2838dae5e8d87a0adc107603b","canonicalization_id":"NINJATRADER_SEMICOLON_OHLCV_UTF8_LF_FINAL_NEWLINE_V1"}},{"civil_date":"2026-06-23","classification":"SESSION","exchange_trading_date":"2026-06-23","schedule_evidence":{"holiday_name":null,"partial_session":false,"expected_open_segments":[{"begin_application":"2026-06-22T17:00:00.0000000-05:00","end_application":"2026-06-23T16:00:00.0000000-05:00","begin_pc":"2026-06-23T06:00:00.0000000+08:00","end_pc":"2026-06-24T05:00:00.0000000+08:00"}],"scheduled_breaks":[],"application_session_begin":"2026-06-22T17:00:00.0000000-05:00","application_session_end":"2026-06-23T16:00:00.0000000-05:00","pc_log_session_begin":"2026-06-23T06:00:00.0000000+08:00","pc_log_session_end":"2026-06-24T05:00:00.0000000+08:00","effective_schedule_source":"SessionIterator using Bars.TradingHours and ActualTradingDayExchange"},"quality":{"observed_native_five_minute_bar_count":276,"observed_valid_count_from_session_start":276,"first_observed_timestamp":"20260623 060500","two_hundred_fiftieth_native_timestamp":"20260624 025000","last_observed_session_timestamp":"20260624 050000","supplied_order_strictly_increasing":true,"duplicate_timestamp_indexes":[],"duplicate_timestamp_count":0,"decreasing_timestamp_indexes":[],"decreasing_timestamp_count":0,"missing_expected_open_timestamps":[],"missing_expected_open_timestamp_count":0,"unexpected_timestamps":[],"unexpected_timestamp_count":0,"malformed_or_non_finite_ohlcv_indexes":[],"malformed_or_non_finite_ohlcv_count":0,"invalid_ohlc_geometry_indexes":[],"invalid_ohlc_geometry_count":0,"negative_volume_indexes":[],"negative_volume_count":0,"non_integral_volume_indexes":[],"non_integral_volume_count":0,"first_250_source_sha256":"c8cd3cd3938d0d712edbbec61d4b4de60dca3958298a90c1ae17c68a896efd18","complete_session_source_sha256":"f5784131d6840d1106ba01b932f35e0aedfc4ce254cac4c36397208f3066d8c7","canonicalization_id":"NINJATRADER_SEMICOLON_OHLCV_UTF8_LF_FINAL_NEWLINE_V1"}},{"civil_date":"2026-06-24","classification":"SESSION","exchange_trading_date":"2026-06-24","schedule_evidence":{"holiday_name":null,"partial_session":false,"expected_open_segments":[{"begin_application":"2026-06-23T17:00:00.0000000-05:00","end_application":"2026-06-24T16:00:00.0000000-05:00","begin_pc":"2026-06-24T06:00:00.0000000+08:00","end_pc":"2026-06-25T05:00:00.0000000+08:00"}],"scheduled_breaks":[],"application_session_begin":"2026-06-23T17:00:00.0000000-05:00","application_session_end":"2026-06-24T16:00:00.0000000-05:00","pc_log_session_begin":"2026-06-24T06:00:00.0000000+08:00","pc_log_session_end":"2026-06-25T05:00:00.0000000+08:00","effective_schedule_source":"SessionIterator using Bars.TradingHours and ActualTradingDayExchange"},"quality":{"observed_native_five_minute_bar_count":276,"observed_valid_count_from_session_start":276,"first_observed_timestamp":"20260624 060500","two_hundred_fiftieth_native_timestamp":"20260625 025000","last_observed_session_timestamp":"20260625 050000","supplied_order_strictly_increasing":true,"duplicate_timestamp_indexes":[],"duplicate_timestamp_count":0,"decreasing_timestamp_indexes":[],"decreasing_timestamp_count":0,"missing_expected_open_timestamps":[],"missing_expected_open_timestamp_count":0,"unexpected_timestamps":[],"unexpected_timestamp_count":0,"malformed_or_non_finite_ohlcv_indexes":[],"malformed_or_non_finite_ohlcv_count":0,"invalid_ohlc_geometry_indexes":[],"invalid_ohlc_geometry_count":0,"negative_volume_indexes":[],"negative_volume_count":0,"non_integral_volume_indexes":[],"non_integral_volume_count":0,"first_250_source_sha256":"c3fdcbaa4732cc2c2db14e34993cfbaa1174a0f84c7d30e55d6b38dafd17c392","complete_session_source_sha256":"c1443bb74f70a6f6b5162a81b9d9e40f64844645840e408f5bdd84153cba6b4d","canonicalization_id":"NINJATRADER_SEMICOLON_OHLCV_UTF8_LF_FINAL_NEWLINE_V1"}},{"civil_date":"2026-06-25","classification":"SESSION","exchange_trading_date":"2026-06-25","schedule_evidence":{"holiday_name":null,"partial_session":false,"expected_open_segments":[{"begin_application":"2026-06-24T17:00:00.0000000-05:00","end_application":"2026-06-25T16:00:00.0000000-05:00","begin_pc":"2026-06-25T06:00:00.0000000+08:00","end_pc":"2026-06-26T05:00:00.0000000+08:00"}],"scheduled_breaks":[],"application_session_begin":"2026-06-24T17:00:00.0000000-05:00","application_session_end":"2026-06-25T16:00:00.0000000-05:00","pc_log_session_begin":"2026-06-25T06:00:00.0000000+08:00","pc_log_session_end":"2026-06-26T05:00:00.0000000+08:00","effective_schedule_source":"SessionIterator using Bars.TradingHours and ActualTradingDayExchange"},"quality":{"observed_native_five_minute_bar_count":276,"observed_valid_count_from_session_start":276,"first_observed_timestamp":"20260625 060500","two_hundred_fiftieth_native_timestamp":"20260626 025000","last_observed_session_timestamp":"20260626 050000","supplied_order_strictly_increasing":true,"duplicate_timestamp_indexes":[],"duplicate_timestamp_count":0,"decreasing_timestamp_indexes":[],"decreasing_timestamp_count":0,"missing_expected_open_timestamps":[],"missing_expected_open_timestamp_count":0,"unexpected_timestamps":[],"unexpected_timestamp_count":0,"malformed_or_non_finite_ohlcv_indexes":[],"malformed_or_non_finite_ohlcv_count":0,"invalid_ohlc_geometry_indexes":[],"invalid_ohlc_geometry_count":0,"negative_volume_indexes":[],"negative_volume_count":0,"non_integral_volume_indexes":[],"non_integral_volume_count":0,"first_250_source_sha256":"83b238cabd2c6091f4777febdd9911338fa65a2445760eb08be5cd678b851a70","complete_session_source_sha256":"0b1b99e3281f95e96dbababc0bb018976b7dcc663335622b0d1f176025295bd7","canonicalization_id":"NINJATRADER_SEMICOLON_OHLCV_UTF8_LF_FINAL_NEWLINE_V1"}},{"civil_date":"2026-06-26","classification":"SESSION","exchange_trading_date":"2026-06-26","schedule_evidence":{"holiday_name":null,"partial_session":false,"expected_open_segments":[{"begin_application":"2026-06-25T17:00:00.0000000-05:00","end_application":"2026-06-26T16:00:00.0000000-05:00","begin_pc":"2026-06-26T06:00:00.0000000+08:00","end_pc":"2026-06-27T05:00:00.0000000+08:00"}],"scheduled_breaks":[],"application_session_begin":"2026-06-25T17:00:00.0000000-05:00","application_session_end":"2026-06-26T16:00:00.0000000-05:00","pc_log_session_begin":"2026-06-26T06:00:00.0000000+08:00","pc_log_session_end":"2026-06-27T05:00:00.0000000+08:00","effective_schedule_source":"SessionIterator using Bars.TradingHours and ActualTradingDayExchange"},"quality":{"observed_native_five_minute_bar_count":276,"observed_valid_count_from_session_start":276,"first_observed_timestamp":"20260626 060500","two_hundred_fiftieth_native_timestamp":"20260627 025000","last_observed_session_timestamp":"20260627 050000","supplied_order_strictly_increasing":true,"duplicate_timestamp_indexes":[],"duplicate_timestamp_count":0,"decreasing_timestamp_indexes":[],"decreasing_timestamp_count":0,"missing_expected_open_timestamps":[],"missing_expected_open_timestamp_count":0,"unexpected_timestamps":[],"unexpected_timestamp_count":0,"malformed_or_non_finite_ohlcv_indexes":[],"malformed_or_non_finite_ohlcv_count":0,"invalid_ohlc_geometry_indexes":[],"invalid_ohlc_geometry_count":0,"negative_volume_indexes":[],"negative_volume_count":0,"non_integral_volume_indexes":[],"non_integral_volume_count":0,"first_250_source_sha256":"8ccd77dd036c49dd49760aade5d02cf17a33c636a419285df9ddcf8dacdf89d2","complete_session_source_sha256":"214b4e2f7ffde3a7c56d3bed83d407ea6c256abe8fca39f8134fa62afb89d056","canonicalization_id":"NINJATRADER_SEMICOLON_OHLCV_UTF8_LF_FINAL_NEWLINE_V1"}},{"civil_date":"2026-06-27",